{"change":{"id":"fixture-change"},"closure_complete":true,"coverage":[],"digest":"c57c689d52cbb7adc37b265c1e6d29c378a9e3c998c3e67764399c5d9cb40dbd","engineering_readiness":"not_evaluated","findings":[],"instances":[{"applicability":"required","dependency_ids":[],"effective_disposition":"create","instance_id":"obligation-a"},{"applicability":"required","dependency_ids":["obligation-a"],"effective_disposition":"create","instance_id":"obligation-b"}],"plan_kind":"draft","planning_status":"complete","schema_version":1,"scopes":[],"semantic_inputs":{},"target_namespace":"fixture-target"}
